{"rows":2,"cols":4,"fusion_2d":[[2,5,4,3],[1,3,3,null]],"size_2d":[[40,90,75,55],[10,65,60,null]],"perimeter_2d":[[60,70,85,65],[20,75,70,null]],"panel_note":"SLOT_08 is a blank placeholder (EMPTY), so null was assigned there; other tiles were scored by visible organoid fusion, burden, and boundary complexity within each droplet."}