{"rows":2,"cols":4,"fusion_2d":[[4,2,1,3],[1,4,4,null]],"size_2d":[[70,55,40,65],[25,75,70,null]],"perimeter_2d":[[80,60,55,65],[35,85,80,null]],"panel_note":"SLOT_08 is an empty placeholder; all other tiles were scored by visible organoid tissue burden, fusion continuity, and boundary complexity within each droplet."}