{"rows":2,"cols":4,"fusion_2d":[[4,2,1,4],[3,4,3,null]],"size_2d":[[85,55,45,80],[70,88,72,null]],"perimeter_2d":[[80,60,55,75],[85,78,82,null]],"panel_note":"SLOT_08 is a blank placeholder labeled EMPTY; all other tiles show substantial organoid tissue with generally higher fusion/burden in SLOTS 01, 04, and 06."}