{"rows":2,"cols":4,"fusion_2d":[[1,2,5,1],[3,4,4,null]],"size_2d":[[35,40,85,25],[60,70,75,null]],"perimeter_2d":[[55,60,70,35],[75,80,70,null]],"panel_note":"SLOT_08 appears to be an empty placeholder; other tiles show varying organoid fusion from weak multi-lobed contacts to one dominant highly fused dark mass (SLOT_03)."}