{"rows":2,"cols":4,"fusion_2d":[[2,3,4,4],[1,5,3,null]],"size_2d":[[45,70,85,80],[25,90,60,null]],"perimeter_2d":[[55,80,90,85],[35,95,70,null]],"panel_note":"SLOT_08 is a blank placeholder (EMPTY), so metrics are null there; other tiles show varying organoid burden with strongest fusion in SLOT_06 and high fusion in SLOT_03-04."}