{"rows":2,"cols":4,"fusion_2d":[[4,2,3,3],[2,3,4,null]],"size_2d":[[80,65,70,68],[55,60,72,null]],"perimeter_2d":[[75,70,75,78],[65,62,80,null]],"panel_note":"SLOT_08 is an empty placeholder; other tiles show varying degrees of organoid fusion with generally moderate-to-high tissue burden and irregular boundaries."}