{"rows":2,"cols":4,"fusion_2d":[[4,2,3,4],[4,1,3,null]],"size_2d":[[78,45,70,68],[74,28,66,null]],"perimeter_2d":[[82,48,72,76],[70,35,64,null]],"panel_note":"SLOT_08 is a blank placeholder (EMPTY), so all metrics are null there; other tiles show varying organoid burden with strongest fusion in SLOT_01, SLOT_04, and SLOT_05."}