{"rows":2,"cols":4,"fusion_2d":[[4,3,3,5],[1,3,4,null]],"size_2d":[[70,62,58,88],[25,55,82,null]],"perimeter_2d":[[78,72,75,90],[40,68,85,null]],"panel_note":"Scored by visual inspection of each labeled tile; SLOT_08 is a blank placeholder (set to null). Other tiles show varying organoid fusion from weak/local contacts to dominant merged masses."}