{"rows":2,"cols":4,"fusion_2d":[[1,5,4,2],[4,2,3,null]],"size_2d":[[35,90,70,40],[75,45,80,null]],"perimeter_2d":[[50,85,80,60],[85,55,70,null]],"panel_note":"SLOT_08 is an empty placeholder (null). Other tiles show heterogeneous organoid burden with strongest fusion in SLOT_02 and high fused/irregular tissue in SLOT_03 and SLOT_05."}