{"rows":2,"cols":4,"fusion_2d":[[2,1,2,4],[3,5,4,null]],"size_2d":[[55,45,60,80],[65,90,78,null]],"perimeter_2d":[[70,55,75,85],[60,95,82,null]],"panel_note":"SLOT_08 is an empty placeholder; other tiles show varying organoid burden and fusion, with strongest continuous tissue in SLOT_06 and high fusion in SLOT_04/SLOT_07."}